{
  "$schema": "../schema/health-address-aliases.schema.json",
  "id": "ministerul-sanatatii-unitati-sanitare-address-aliases-2026",
  "title": "Curated Ministry health address aliases",
  "publisher": "Cristian Nichifor",
  "source": {
    "id": "ministerul-sanatatii-unitati-sanitare-2026",
    "publisher": "Ministerul Sanatatii",
    "sourceUrl": "https://ms.ro/ro/unitati-sanitare/",
    "retrievedDate": "2026-09-09"
  },
  "reviewedDate": "2026-09-09",
  "provenance": {
    "source": "ministerul-sanatatii-unitati-sanitare-2026 + health-access-mart-2024-2025",
    "locator": "Curated providerId to sourceRecordId aliases for official Ministry map rows whose names differ from ANMCS names by city suffixes, diacritics, punctuation, abbreviations or patronymic wording.",
    "confidence": "derived",
    "note": "Aliases are accepted only when the builder can verify that the provider, alias row and official Ministry source row still share the same county and the source row still carries a street address."
  },
  "aliases": [
    {
      "providerId": "anmcs-2025-183",
      "sourceRecordId": "ms-unitati-sanitare-017",
      "countyCode": "AB",
      "matchMethod": "curated-same-county-official-name-alias",
      "reason": "Same Abrud town hospital; ANMCS includes the Dr. Alexandru Borza patronymic while the Ministry source uses the shorter official map name."
    },
    {
      "providerId": "anmcs-2025-323",
      "sourceRecordId": "ms-unitati-sanitare-041",
      "countyCode": "AG",
      "matchMethod": "curated-same-county-official-name-alias",
      "reason": "Same Sf. Maria psychiatry hospital in Vedea; wording differs only by locality suffix and punctuation."
    },
    {
      "providerId": "anmcs-2025-346",
      "sourceRecordId": "ms-unitati-sanitare-057",
      "countyCode": "AG",
      "matchMethod": "curated-same-county-official-name-alias",
      "reason": "Same Calinesti chronic-disease hospital; ANMCS adds integrated ambulatory wording."
    },
    {
      "providerId": "anmcs-2025-405",
      "sourceRecordId": "ms-unitati-sanitare-027",
      "countyCode": "AG",
      "matchMethod": "curated-same-county-official-name-alias",
      "reason": "Same Campulung pneumoftiziology hospital; ANMCS adds integrated ambulatory wording."
    },
    {
      "providerId": "anmcs-2025-009",
      "sourceRecordId": "ms-unitati-sanitare-193",
      "countyCode": "B",
      "matchMethod": "curated-same-county-official-name-alias",
      "reason": "Same Filantropia clinical hospital; ANMCS adds Bucharest locality suffix."
    },
    {
      "providerId": "anmcs-2025-014",
      "sourceRecordId": "ms-unitati-sanitare-157",
      "countyCode": "B",
      "matchMethod": "curated-same-county-official-name-alias",
      "reason": "Same C.I. Parhon national endocrinology institute; ANMCS adds Bucharest locality suffix."
    },
    {
      "providerId": "anmcs-2025-026",
      "sourceRecordId": "ms-unitati-sanitare-145",
      "countyCode": "B",
      "matchMethod": "curated-same-county-official-name-alias",
      "reason": "Same Prof. Dr. Alexandru Trestioreanu oncology institute; wording differs only by abbreviated given name."
    },
    {
      "providerId": "anmcs-2025-027",
      "sourceRecordId": "ms-unitati-sanitare-178",
      "countyCode": "B",
      "matchMethod": "curated-same-county-official-name-alias",
      "reason": "Same ophthalmology emergency clinical hospital; Ministry source adds Bucharest suffix."
    },
    {
      "providerId": "anmcs-2025-032",
      "sourceRecordId": "ms-unitati-sanitare-175",
      "countyCode": "B",
      "matchMethod": "curated-same-county-official-name-alias",
      "reason": "Same plastic, reconstructive and burns emergency clinical hospital; Ministry source also carries the SCUCPRA acronym."
    },
    {
      "providerId": "anmcs-2025-044",
      "sourceRecordId": "ms-unitati-sanitare-198",
      "countyCode": "B",
      "matchMethod": "curated-same-county-official-name-alias",
      "reason": "Same Sf. Pantelimon emergency clinical hospital; wording differs only by punctuation and omitted Bucharest suffix."
    },
    {
      "providerId": "anmcs-2025-050",
      "sourceRecordId": "ms-unitati-sanitare-199",
      "countyCode": "B",
      "matchMethod": "curated-same-county-official-name-alias",
      "reason": "Same Dr. Victor Babes infectious and tropical diseases hospital; wording differs only by article and punctuation."
    },
    {
      "providerId": "anmcs-2025-070",
      "sourceRecordId": "ms-unitati-sanitare-177",
      "countyCode": "B",
      "matchMethod": "curated-same-county-official-name-alias",
      "reason": "Same Prof. Dr. Theodor Burghele clinical hospital; ANMCS abbreviates the given name."
    },
    {
      "providerId": "anmcs-2025-253",
      "sourceRecordId": "ms-unitati-sanitare-174",
      "countyCode": "B",
      "matchMethod": "curated-same-county-official-name-alias",
      "reason": "Same C.F. Witting clinical hospital; Ministry source adds Bucharest suffix and spacing differs around C.F."
    },
    {
      "providerId": "anmcs-2025-272",
      "sourceRecordId": "ms-unitati-sanitare-195",
      "countyCode": "B",
      "matchMethod": "curated-same-county-official-name-alias",
      "reason": "Same Sf. Stefan pneumoftiziology hospital; Ministry source adds Bucharest suffix."
    },
    {
      "providerId": "anmcs-2025-305",
      "sourceRecordId": "ms-unitati-sanitare-093",
      "countyCode": "B",
      "matchMethod": "curated-same-county-official-name-alias",
      "reason": "Same Sf. Stelian youth toxic-dependency evaluation and treatment centre; wording differs only by abbreviation and punctuation."
    },
    {
      "providerId": "anmcs-2025-104",
      "sourceRecordId": "ms-unitati-sanitare-033",
      "countyCode": "BC",
      "matchMethod": "curated-same-county-official-name-alias",
      "reason": "Same Moinesti municipal emergency hospital; spelling and diacritics differ."
    },
    {
      "providerId": "anmcs-2025-196",
      "sourceRecordId": "ms-unitati-sanitare-087",
      "countyCode": "BH",
      "matchMethod": "curated-same-county-official-name-alias",
      "reason": "Same CF Oradea clinical hospital; source and ANMCS differ only by punctuation around CF."
    },
    {
      "providerId": "anmcs-2025-087",
      "sourceRecordId": "ms-unitati-sanitare-021",
      "countyCode": "BR",
      "matchMethod": "curated-same-county-official-name-alias",
      "reason": "Same Braila county emergency clinical hospital; ANMCS adds clinical wording."
    },
    {
      "providerId": "anmcs-2025-288",
      "sourceRecordId": "ms-unitati-sanitare-099",
      "countyCode": "BT",
      "matchMethod": "curated-same-county-official-name-alias",
      "reason": "Same Sf. Gheorghe recovery hospital in Botosani; wording differs only by saint abbreviation."
    },
    {
      "providerId": "anmcs-2025-065",
      "sourceRecordId": "ms-unitati-sanitare-044",
      "countyCode": "BV",
      "matchMethod": "curated-same-county-official-name-alias",
      "reason": "Same Brasov children emergency clinical hospital; Ministry source inserts 'din'."
    },
    {
      "providerId": "anmcs-2025-209",
      "sourceRecordId": "ms-unitati-sanitare-046",
      "countyCode": "BV",
      "matchMethod": "curated-same-county-official-name-alias",
      "reason": "Same Brasov railway general hospital; ANMCS abbreviates Cai Ferate as C.F."
    },
    {
      "providerId": "anmcs-2025-024",
      "sourceRecordId": "ms-unitati-sanitare-209",
      "countyCode": "CJ",
      "matchMethod": "curated-same-county-official-name-alias",
      "reason": "Same Niculae Stancioiu heart institute in Cluj-Napoca; Ministry source shortens locality to Cluj."
    },
    {
      "providerId": "anmcs-2025-206",
      "sourceRecordId": "ms-unitati-sanitare-290",
      "countyCode": "GJ",
      "matchMethod": "curated-same-county-official-name-alias",
      "reason": "Same Ghe. Constantinescu town hospital in Bumbesti-Jiu; wording differs by abbreviation and punctuation."
    },
    {
      "providerId": "anmcs-2025-249",
      "sourceRecordId": "ms-unitati-sanitare-287",
      "countyCode": "GJ",
      "matchMethod": "curated-same-county-official-name-alias",
      "reason": "Same Sfantul Stefan town hospital in Rovinari; wording differs only by saint abbreviation."
    },
    {
      "providerId": "anmcs-2025-143",
      "sourceRecordId": "ms-unitati-sanitare-253",
      "countyCode": "HD",
      "matchMethod": "curated-same-county-official-name-alias",
      "reason": "Same CF Simeria general hospital; ANMCS abbreviates Cai Ferate as C.F."
    },
    {
      "providerId": "anmcs-2025-043",
      "sourceRecordId": "ms-unitati-sanitare-231",
      "countyCode": "IS",
      "matchMethod": "curated-same-county-official-name-alias",
      "reason": "Same Sf. Spiridon county emergency clinical hospital in Iasi; wording differs only by saint abbreviation."
    },
    {
      "providerId": "anmcs-2025-056",
      "sourceRecordId": "ms-unitati-sanitare-241",
      "countyCode": "IS",
      "matchMethod": "curated-same-county-official-name-alias",
      "reason": "Same Cuza Voda obstetrics-gynaecology clinical hospital in Iasi; source uses hyphenated specialty wording."
    },
    {
      "providerId": "anmcs-2025-058",
      "sourceRecordId": "ms-unitati-sanitare-232",
      "countyCode": "IS",
      "matchMethod": "curated-same-county-official-name-alias",
      "reason": "Same Iasi recovery clinical hospital; Ministry source includes county wording."
    },
    {
      "providerId": "anmcs-2025-190",
      "sourceRecordId": "ms-unitati-sanitare-277",
      "countyCode": "MH",
      "matchMethod": "curated-same-county-official-name-alias",
      "reason": "Same Orsova municipal hospital; source spelling differs."
    },
    {
      "providerId": "anmcs-2025-257",
      "sourceRecordId": "ms-unitati-sanitare-273",
      "countyCode": "MM",